{
    "version": "3.0",
    "name": "default deployment Name",
    "referenceDeployment": {},
    
    "deploymentProperties": [
        {
            "propertyKey": "SHARED_MEMORY_TABLES_STATUS",
            "description": "SHARED_MEMORY_TABLES_STATUS", 
            "alias": "serverConfigStatus", 
            "category": "GENERAL", 
            "value": "FALSE", 
            "required": 1, 
            "overWriteValue": "Y",
            "deprecated": true, 
            "defaultValue": "10.253.89.65", 
            "sequence": 4, 
            "active": true, 
            "manualEntry": false,
            "status": 5 
        },
          {
            "propertyKey": "SHARED_MEMORY_TABLES_STATUS", 
            "description": "SHARED_MEMORY_TABLES_STATUS", 
            "alias": "serverConfigStatus", 
            "category": "DATABASE", 
            "value": null, 
            "required": 1, 
            "overWriteValue": "Y",
            "deprecated": true, 
            "defaultValue": "10.243.13.9", 
            "sequence": 8, 
            "active": true, 
            "manualEntry": false,
            "status": 6 
        }
    ]
}